{
  "schema_version": 1,
  "kind": "pass",
  "run_id": 123456,
  "run_attempt": 1,
  "repository_id": 42,
  "pr_number": 7,
  "head_sha": "aaaaaaaaaaaaaaaaaaaaaaaaaaaaaaaaaaaaaaaa",
  "base_repository_id": 42,
  "base_ref": "main",
  "base_tip_sha": "bbbbbbbbbbbbbbbbbbbbbbbbbbbbbbbbbbbbbbbb",
  "merge_base_sha": "cccccccccccccccccccccccccccccccccccccccc",
  "status": "skipped-size",
  "payload": {},
  "pass": "security"
}
